06:57:00.377681 IP 138.197.134.101.ssh > bras-vprn-toroon474aw-lp130-02-174-88-169-56.dsl.bell.ca.55452: Flags [P.], seq 5745008:5745364, ack 3637, win 501, length 356
06:57:00.377928 IP bras-vprn-toroon474aw-lp130-02-174-88-169-56.dsl.bell.ca.55452 > 138.197.134.101.ssh: Flags [.], ack 5743480, win 1026, length 0
06:57:00.377950 IP 138.197.134.101.ssh > bras-vprn-toroon474aw-lp130-02-174-88-169-56.dsl.bell.ca.55452: Flags [P.], seq 5745364:5745568, ack 3637, win 501, length 204
06:57:00.378159 IP 138.197.134.101.ssh > bras-vprn-toroon474aw-lp130-02-174-88-169-56.dsl.bell.ca.55452: Flags [P.], seq 5745568:5745924, ack 3637, win 501, length 356
06:57:00.378331 IP 138.197.134.101.ssh > bras-vprn-toroon474aw-lp130-02-174-88-169-56.dsl.bell.ca.55452: Flags [P.], seq 5745924:5746128, ack 3637, win 501, length 204
06:57:00.378497 IP 138.197.134.101.ssh > bras-vprn-toroon474aw-lp130-02-174-88-169-56.dsl.bell.ca.55452: Flags [P.], seq 5746128:5746332, ack 3637, win 501, length 204
06:57:00.378652 IP 138.197.134.101.ssh > bras-vprn-toroon474aw-lp130-02-174-88-169-56.dsl.bell.ca.55452: Flags [P.], seq 5746332:5746536, ack 3637, win 501, length 204
06:57:00.379057 IP bras-vprn-toroon474aw-lp130-02-174-88-169-56.dsl.bell.ca.55452 > 138.197.134.101.ssh: Flags [.], ack 5744600, win 1022, length 0
06:57:00.379057 IP bras-vprn-toroon474aw-lp130-02-174-88-169-56.dsl.bell.ca.55452 > 138.197.134.101.ssh: Flags [.], ack 5745008, win 1026, length 0
06:57:00.379092 IP 138.197.134.101.ssh > bras-vprn-toroon474aw-lp130-02-174-88-169-56.dsl.bell.ca.55452: Flags [P.], seq 5746536:5746740, ack 3637, win 501, length 204
06:57:00.379338 IP 138.197.134.101.ssh > bras-vprn-toroon474aw-lp130-02-174-88-169-56.dsl.bell.ca.55452: Flags [P.], seq 5746740:5747248, ack 3637, win 501, length 508
06:57:00.379514 IP bras-vprn-toroon474aw-lp130-02-174-88-169-56.dsl.bell.ca.55452 > 138.197.134.101.ssh: Flags [.], ack 5745568, win 1024, length 0
06:57:00.379642 IP 138.197.134.101.ssh > bras-vprn-toroon474aw-lp130-02-174-88-169-56.dsl.bell.ca.55452: Flags [P.], seq 5747248:5747452, ack 3637, win 501, length 204
06:57:00.379809 IP 138.197.134.101.ssh > bras-vprn-toroon474aw-lp130-02-174-88-169-56.dsl.bell.ca.55452: Flags [P.], seq 5747452:5747640, ack 3637, win 501, length 188
06:57:00.379887 IP bras-vprn-toroon474aw-lp130-02-174-88-169-56.dsl.bell.ca.55452 > 138.197.134.101.ssh: Flags [.], ack 5746128, win 1022, length 0
06:57:00.379938 IP 138.197.134.101.ssh > bras-vprn-toroon474aw-lp130-02-174-88-169-56.dsl.bell.ca.55452: Flags [P.], seq 5747640:5747844, ack 3637, win 501, length 204
06:57:00.380160 IP 138.197.134.101.ssh > bras-vprn-toroon474aw-lp130-02-174-88-169-56.dsl.bell.ca.55452: Flags [P.], seq 5747844:5748368, ack 3637, win 501, length 524
06:57:00.380321 IP 138.197.134.101.ssh > bras-vprn-toroon474aw-lp130-02-174-88-169-56.dsl.bell.ca.55452: Flags [P.], seq 5748368:5748572, ack 3637, win 501, length 204
06:57:00.380503 IP 138.197.134.101.ssh > bras-vprn-toroon474aw-lp130-02-174-88-169-56.dsl.bell.ca.55452: Flags [P.], seq 5748572:5748776, ack 3637, win 501, length 204
06:57:00.380762 IP bras-vprn-toroon474aw-lp130-02-174-88-169-56.dsl.bell.ca.55452 > 138.197.134.101.ssh: Flags [.], ack 5746536, win 1026, length 0
06:57:00.380790 IP 138.197.134.101.ssh > bras-vprn-toroon474aw-lp130-02-174-88-169-56.dsl.bell.ca.55452: Flags [P.], seq 5748776:5748980, ack 3637, win 501, length 204
06:57:00.380877 IP bras-vprn-toroon474aw-lp130-02-174-88-169-56.dsl.bell.ca.55452 > 138.197.134.101.ssh: Flags [.], ack 5747248, win 1023, length 0
06:57:00.381061 IP 138.197.134.101.ssh > bras-vprn-toroon474aw-lp130-02-174-88-169-56.dsl.bell.ca.55452: Flags [P.], seq 5748980:5749488, ack 3637, win 501, length 508
06:57:00.381221 IP 138.197.134.101.ssh > bras-vprn-toroon474aw-lp130-02-174-88-169-56.dsl.bell.ca.55452: Flags [P.], seq 5749488:5749692, ack 3637, win 501, length 204
06:57:00.381384 IP 138.197.134.101.ssh > bras-vprn-toroon474aw-lp130-02-174-88-169-56.dsl.bell.ca.55452: Flags [P.], seq 5749692:5749896, ack 3637, win 501, length 204
06:57:00.381510 IP bras-vprn-toroon474aw-lp130-02-174-88-169-56.dsl.bell.ca.55452 > 138.197.134.101.ssh: Flags [.], ack 5747844, win 1021, length 0
06:57:00.381669 IP 138.197.134.101.ssh > bras-vprn-toroon474aw-lp130-02-174-88-169-56.dsl.bell.ca.55452: Flags [P.], seq 5749896:5750252, ack 3637, win 501, length 356
06:57:00.381888 IP bras-vprn-toroon474aw-lp130-02-174-88-169-56.dsl.bell.ca.55452 > 138.197.134.101.ssh: Flags [.], ack 5748368, win 1026, length 0
06:57:00.382132 IP 138.197.134.101.ssh > bras-vprn-toroon474aw-lp130-02-174-88-169-56.dsl.bell.ca.55452: Flags [P.], seq 5750252:5750608, ack 3637, win 501, length 356
06:57:00.382163 IP bras-vprn-toroon474aw-lp130-02-174-88-169-56.dsl.bell.ca.55452 > 138.197.134.101.ssh: Flags [.], ack 5748776, win 1025, length 0
06:57:00.382359 IP 138.197.134.101.ssh > bras-vprn-toroon474aw-lp130-02-174-88-169-56.dsl.bell.ca.55452: Flags [P.], seq 5750608:5750964, ack 3637, win 501, length 356
06:57:00.382531 IP 138.197.134.101.ssh > bras-vprn-toroon474aw-lp130-02-174-88-169-56.dsl.bell.ca.55452: Flags [P.], seq 5750964:5751168, ack 3637, win 501, length 204
06:57:00.382655 IP bras-vprn-toroon474aw-lp130-02-174-88-169-56.dsl.bell.ca.55452 > 138.197.134.101.ssh: Flags [.], ack 5749488, win 1022, length 0
06:57:00.382803 IP 138.197.134.101.ssh > bras-vprn-toroon474aw-lp130-02-174-88-169-56.dsl.bell.ca.55452: Flags [P.], seq 5751168:5751524, ack 3637, win 501, length 356
06:57:00.382975 IP 138.197.134.101.ssh > bras-vprn-toroon474aw-lp130-02-174-88-169-56.dsl.bell.ca.55452: Flags [P.], seq 5751524:5751728, ack 3637, win 501, length 204
06:57:00.383016 IP bras-vprn-toroon474aw-lp130-02-174-88-169-56.dsl.bell.ca.55452 > 138.197.134.101.ssh: Flags [.], ack 5749896, win 1026, length 0
06:57:00.383191 IP 138.197.134.101.ssh > bras-vprn-toroon474aw-lp130-02-174-88-169-56.dsl.bell.ca.55452: Flags [P.], seq 5751728:5752084, ack 3637, win 501, length 356
06:57:00.383357 IP 138.197.134.101.ssh > bras-vprn-toroon474aw-lp130-02-174-88-169-56.dsl.bell.ca.55452: Flags [P.], seq 5752084:5752288, ack 3637, win 501, length 204
06:57:00.383540 IP 138.197.134.101.ssh > bras-vprn-toroon474aw-lp130-02-174-88-169-56.dsl.bell.ca.55452: Flags [P.], seq 5752288:5752492, ack 3637, win 501, length 204
06:57:00.383714 IP 138.197.134.101.ssh > bras-vprn-toroon474aw-lp130-02-174-88-169-56.dsl.bell.ca.55452: Flags [P.], seq 5752492:5752696, ack 3637, win 501, length 204
06:57:00.383917 IP 138.197.134.101.ssh > bras-vprn-toroon474aw-lp130-02-174-88-169-56.dsl.bell.ca.55452: Flags [P.], seq 5752696:5752900, ack 3637, win 501, length 204
06:57:00.384018 IP bras-vprn-toroon474aw-lp130-02-174-88-169-56.dsl.bell.ca.55452 > 138.197.134.101.ssh: Flags [.], ack 5751168, win 1021, length 0
06:57:00.384167 IP 138.197.134.101.ssh > bras-vprn-toroon474aw-lp130-02-174-88-169-56.dsl.bell.ca.55452: Flags [P.], seq 5752900:5753256, ack 3637, win 501, length 356
06:57:00.384265 IP bras-vprn-toroon474aw-lp130-02-174-88-169-56.dsl.bell.ca.55452 > 138.197.134.101.ssh: Flags [P.], seq 3637:3673, ack 5751168, win 1021, length 36
