06:56:22.575249 IP 138.197.134.101.22 > 174.88.169.56.55452: Flags [P.], seq 6334496:6334660, ack 3781, win 501, length 164
06:56:22.575353 IP 138.197.134.101.22 > 174.88.169.56.55452: Flags [P.], seq 6334660:6334824, ack 3781, win 501, length 164
06:56:22.575455 IP 138.197.134.101.22 > 174.88.169.56.55452: Flags [P.], seq 6334824:6334988, ack 3781, win 501, length 164
06:56:22.575554 IP 138.197.134.101.22 > 174.88.169.56.55452: Flags [P.], seq 6334988:6335152, ack 3781, win 501, length 164
06:56:22.575654 IP 138.197.134.101.22 > 174.88.169.56.55452: Flags [P.], seq 6335152:6335316, ack 3781, win 501, length 164
06:56:22.575753 IP 138.197.134.101.22 > 174.88.169.56.55452: Flags [P.], seq 6335316:6335480, ack 3781, win 501, length 164
06:56:22.575853 IP 138.197.134.101.22 > 174.88.169.56.55452: Flags [P.], seq 6335480:6335644, ack 3781, win 501, length 164
06:56:22.575949 IP 138.197.134.101.22 > 174.88.169.56.55452: Flags [P.], seq 6335644:6335808, ack 3781, win 501, length 164
06:56:22.576047 IP 138.197.134.101.22 > 174.88.169.56.55452: Flags [P.], seq 6335808:6335972, ack 3781, win 501, length 164
06:56:22.576138 IP 138.197.134.101.22 > 174.88.169.56.55452: Flags [P.], seq 6335972:6336136, ack 3781, win 501, length 164
06:56:22.576234 IP 138.197.134.101.22 > 174.88.169.56.55452: Flags [P.], seq 6336136:6336300, ack 3781, win 501, length 164
06:56:22.576335 IP 138.197.134.101.22 > 174.88.169.56.55452: Flags [P.], seq 6336300:6336464, ack 3781, win 501, length 164
06:56:22.576423 IP 138.197.134.101.22 > 174.88.169.56.55452: Flags [P.], seq 6336464:6336628, ack 3781, win 501, length 164
06:56:22.576509 IP 138.197.134.101.22 > 174.88.169.56.55452: Flags [P.], seq 6336628:6336792, ack 3781, win 501, length 164
06:56:22.576605 IP 138.197.134.101.22 > 174.88.169.56.55452: Flags [P.], seq 6336792:6336956, ack 3781, win 501, length 164
06:56:22.576707 IP 138.197.134.101.22 > 174.88.169.56.55452: Flags [P.], seq 6336956:6337120, ack 3781, win 501, length 164
06:56:22.576818 IP 138.197.134.101.22 > 174.88.169.56.55452: Flags [P.], seq 6337120:6337284, ack 3781, win 501, length 164
06:56:22.576914 IP 138.197.134.101.22 > 174.88.169.56.55452: Flags [P.], seq 6337284:6337448, ack 3781, win 501, length 164
06:56:22.577013 IP 138.197.134.101.22 > 174.88.169.56.55452: Flags [P.], seq 6337448:6337612, ack 3781, win 501, length 164
06:56:22.577113 IP 138.197.134.101.22 > 174.88.169.56.55452: Flags [P.], seq 6337612:6337776, ack 3781, win 501, length 164
06:56:22.577210 IP 138.197.134.101.22 > 174.88.169.56.55452: Flags [P.], seq 6337776:6337940, ack 3781, win 501, length 164
06:56:22.577301 IP 138.197.134.101.22 > 174.88.169.56.55452: Flags [P.], seq 6337940:6338104, ack 3781, win 501, length 164
06:56:22.577407 IP 138.197.134.101.22 > 174.88.169.56.55452: Flags [P.], seq 6338104:6338268, ack 3781, win 501, length 164
06:56:22.577513 IP 138.197.134.101.22 > 174.88.169.56.55452: Flags [P.], seq 6338268:6338432, ack 3781, win 501, length 164
06:56:22.577603 IP 138.197.134.101.22 > 174.88.169.56.55452: Flags [P.], seq 6338432:6338596, ack 3781, win 501, length 164
06:56:22.577705 IP 138.197.134.101.22 > 174.88.169.56.55452: Flags [P.], seq 6338596:6338760, ack 3781, win 501, length 164
06:56:22.577807 IP 138.197.134.101.22 > 174.88.169.56.55452: Flags [P.], seq 6338760:6338924, ack 3781, win 501, length 164
06:56:22.577897 IP 138.197.134.101.22 > 174.88.169.56.55452: Flags [P.], seq 6338924:6339088, ack 3781, win 501, length 164
06:56:22.577992 IP 138.197.134.101.22 > 174.88.169.56.55452: Flags [P.], seq 6339088:6339252, ack 3781, win 501, length 164
06:56:22.578089 IP 138.197.134.101.22 > 174.88.169.56.55452: Flags [P.], seq 6339252:6339416, ack 3781, win 501, length 164
06:56:22.578191 IP 138.197.134.101.22 > 174.88.169.56.55452: Flags [P.], seq 6339416:6339580, ack 3781, win 501, length 164
06:56:22.578287 IP 138.197.134.101.22 > 174.88.169.56.55452: Flags [P.], seq 6339580:6339744, ack 3781, win 501, length 164
06:56:22.578384 IP 138.197.134.101.22 > 174.88.169.56.55452: Flags [P.], seq 6339744:6339908, ack 3781, win 501, length 164
06:56:22.578500 IP 138.197.134.101.22 > 174.88.169.56.55452: Flags [P.], seq 6339908:6340072, ack 3781, win 501, length 164
06:56:22.578623 IP 138.197.134.101.22 > 174.88.169.56.55452: Flags [P.], seq 6340072:6340236, ack 3781, win 501, length 164
06:56:22.578722 IP 138.197.134.101.22 > 174.88.169.56.55452: Flags [P.], seq 6340236:6340400, ack 3781, win 501, length 164
06:56:22.578816 IP 138.197.134.101.22 > 174.88.169.56.55452: Flags [P.], seq 6340400:6340564, ack 3781, win 501, length 164
06:56:22.578918 IP 138.197.134.101.22 > 174.88.169.56.55452: Flags [P.], seq 6340564:6340728, ack 3781, win 501, length 164
06:56:22.579016 IP 138.197.134.101.22 > 174.88.169.56.55452: Flags [P.], seq 6340728:6340892, ack 3781, win 501, length 164
06:56:22.579125 IP 138.197.134.101.22 > 174.88.169.56.55452: Flags [P.], seq 6340892:6341056, ack 3781, win 501, length 164
06:56:22.579216 IP 138.197.134.101.22 > 174.88.169.56.55452: Flags [P.], seq 6341056:6341220, ack 3781, win 501, length 164
06:56:22.579314 IP 138.197.134.101.22 > 174.88.169.56.55452: Flags [P.], seq 6341220:6341384, ack 3781, win 501, length 164
06:56:22.579419 IP 138.197.134.101.22 > 174.88.169.56.55452: Flags [P.], seq 6341384:6341548, ack 3781, win 501, length 164
06:56:22.579522 IP 138.197.134.101.22 > 174.88.169.56.55452: Flags [P.], seq 6341548:6341712, ack 3781, win 501, length 164
06:56:22.579542 IP 174.88.169.56.55452 > 138.197.134.101.22: Flags [.], ack 6318216, win 1026, length 0
06:56:22.579542 IP 174.88.169.56.55452 > 138.197.134.101.22: Flags [.], ack 6320064, win 1026, length 0
06:56:22.579643 IP 174.88.169.56.55452 > 138.197.134.101.22: Flags [.], ack 6321704, win 1026, length 0
06:56:22.579643 IP 174.88.169.56.55452 > 138.197.134.101.22: Flags [.], ack 6323344, win 1026, length 0
06:56:22.579751 IP 138.197.134.101.22 > 174.88.169.56.55452: Flags [P.], seq 6341712:6342292, ack 3781, win 501, length 580
06:56:22.579784 IP 174.88.169.56.55452 > 138.197.134.101.22: Flags [.], ack 6324984, win 1026, length 0
06:56:22.579784 IP 174.88.169.56.55452 > 138.197.134.101.22: Flags [.], ack 6326624, win 1026, length 0
06:56:22.579784 IP 174.88.169.56.55452 > 138.197.134.101.22: Flags [.], ack 6328264, win 1026, length 0
06:56:22.579918 IP 174.88.169.56.55452 > 138.197.134.101.22: Flags [.], ack 6329904, win 1026, length 0
06:56:22.579918 IP 174.88.169.56.55452 > 138.197.134.101.22: Flags [.], ack 6331544, win 1026, length 0
06:56:22.579918 IP 174.88.169.56.55452 > 138.197.134.101.22: Flags [.], ack 6333184, win 1026, length 0
06:56:22.579972 IP 138.197.134.101.22 > 174.88.169.56.55452: Flags [P.], seq 6342292:6342768, ack 3781, win 501, length 476
06:56:22.580056 IP 174.88.169.56.55452 > 138.197.134.101.22: Flags [.], ack 6334824, win 1026, length 0
06:56:22.580056 IP 174.88.169.56.55452 > 138.197.134.101.22: Flags [.], ack 6336464, win 1026, length 0
06:56:22.580149 IP 174.88.169.56.55452 > 138.197.134.101.22: Flags [.], ack 6338104, win 1026, length 0
06:56:22.580149 IP 174.88.169.56.55452 > 138.197.134.101.22: Flags [.], ack 6339744, win 1026, length 0
06:56:22.580149 IP 174.88.169.56.55452 > 138.197.134.101.22: Flags [.], ack 6340400, win 1024, length 0
06:56:22.580263 IP 138.197.134.101.22 > 174.88.169.56.55452: Flags [P.], seq 6342768:6343772, ack 3781, win 501, length 1004
06:56:22.580290 IP 174.88.169.56.55452 > 138.197.134.101.22: Flags [.], ack 6340564, win 1023, length 0
06:56:22.580406 IP 174.88.169.56.55452 > 138.197.134.101.22: Flags [P.], seq 3781:3817, ack 6340564, win 1023, length 36
06:56:22.580406 IP 174.88.169.56.55452 > 138.197.134.101.22: Flags [P.], seq 3817:3853, ack 6340728, win 1022, length 36
06:56:22.580419 IP 138.197.134.101.22 > 174.88.169.56.55452: Flags [P.], seq 6343772:6344040, ack 3781, win 501, length 268
